{
    "title": "Model YAML Schema",
    "description": "Schema for yggdrasil model YAML input files.",
    "type": "object",
    "definitions": {
        "comm": {
            "description": "Base schema for all subtypes of comm components.",
            "additionalProperties": false,
            "dependencies": {
                "driver": [
                    "args"
                ]
            },
            "properties": {
                "commtype": {
                    "default": "default",
                    "description": "Communication mechanism that should be used.",
                    "enum": [
                        "buffer",
                        "default",
                        "ipc",
                        "mpi",
                        "rest",
                        "rmq",
                        "rmq_async",
                        "value",
                        "zmq"
                    ],
                    "type": "string"
                },
                "datatype": {
                    "$ref": "#/definitions/schema"
                },
                "default_file": {
                    "$ref": "#/definitions/file"
                },
                "default_value": {
                    "description": "Value that should be returned in the event that a yaml does not pair the comm with another model comm or a file.",
                    "type": "any"
                },
                "filter": {
                    "$ref": "#/definitions/filter",
                    "description": "Filter that will be used to determine when messages should be sent/received. Ignored if not provided."
                },
                "format_str": {
                    "description": "String that should be used to format/parse messages. Default to None.",
                    "type": "string"
                },
                "name": {
                    "description": "Name used for component in log messages.",
                    "type": "string"
                },
                "outside_loop": {
                    "default": false,
                    "description": "If True, and the comm is an input/outputs to/from a model being wrapped. The receive/send calls for this comm will be outside the loop for the model. Defaults to False.",
                    "type": "boolean",
                    "format": "checkbox"
                },
                "transform": {
                    "type": "array",
                    "items": {
                        "$ref": "#/definitions/transform"
                    },
                    "description": "One or more transformations that will be applied to messages that are sent/received. Ignored if not provided."
                },
                "vars": {
                    "description": "Names of variables to be sent/received by this comm. Defaults to [].",
                    "items": {
                        "type": "string"
                    },
                    "type": "array"
                },
                "count": {
                    "default": 1,
                    "type": "integer",
                    "options": {
                        "dependencies": {
                            "commtype": [
                                "value"
                            ]
                        }
                    }
                }
            },
            "required": [
                "datatype",
                "name",
                "commtype"
            ],
            "type": "object"
        },
        "file": {
            "description": "Base schema for all subtypes of file components.",
            "additionalProperties": false,
            "dependencies": {
                "driver": [
                    "args"
                ]
            },
            "properties": {
                "append": {
                    "default": false,
                    "description": "If True and writing, file is openned in append mode. If True and reading, file is kept open even if the end of the file is reached to allow for another process to write to the file in append mode. Defaults to False.",
                    "type": "boolean",
                    "format": "checkbox"
                },
                "filetype": {
                    "default": "binary",
                    "description": "The type of file that will be read from or written to.",
                    "enum": [
                        "ascii",
                        "binary",
                        "json",
                        "map",
                        "mat",
                        "netcdf",
                        "obj",
                        "pandas",
                        "pickle",
                        "ply",
                        "table",
                        "wofost",
                        "yaml"
                    ],
                    "type": "string"
                },
                "filter": {
                    "$ref": "#/definitions/filter",
                    "description": "Filter that will be used to determine when messages should be sent/received. Ignored if not provided."
                },
                "format_str": {
                    "description": "String that should be used to format/parse messages. Default to None.",
                    "type": "string"
                },
                "is_series": {
                    "default": false,
                    "description": "If True, input/output will be done to a series of files. If reading, each file will be processed until the end is reached. If writing, each output will be to a new file in the series. The addressed is assumed to contain a format for the index of the file. Defaults to False.",
                    "type": "boolean",
                    "format": "checkbox"
                },
                "name": {
                    "description": "Name used for component in log messages.",
                    "type": "string"
                },
                "transform": {
                    "anyOf": [
                        {
                            "$ref": "#/definitions/transform"
                        },
                        {
                            "type": "string"
                        },
                        {
                            "items": {
                                "anyOf": [
                                    {
                                        "$ref": "#/definitions/transform"
                                    },
                                    {
                                        "type": "string"
                                    }
                                ]
                            },
                            "type": "array"
                        }
                    ],
                    "description": "One or more transformations that will be applied to messages that are sent/received. Ignored if not provided."
                },
                "vars": {
                    "description": "Names of variables to be sent/received by this comm. Defaults to [].",
                    "items": {
                        "type": "string"
                    },
                    "type": "array"
                },
                "comment": {
                    "default": "# ",
                    "description": "One or more characters indicating a comment. Defaults to '# '.",
                    "type": "string",
                    "options": {
                        "dependencies": {
                            "filetype": [
                                "map",
                                "ply",
                                "netcdf",
                                "wofost",
                                "table",
                                "mat",
                                "ascii",
                                "pandas",
                                "obj",
                                "yaml",
                                "json",
                                "pickle"
                            ]
                        }
                    }
                },
                "delimiter": {
                    "default": "\t",
                    "description": "Delimiter that should be used to separate name/value pairs in the map. Defaults to \\t.",
                    "type": "string",
                    "options": {
                        "dependencies": {
                            "filetype": [
                                "map",
                                "wofost",
                                "table",
                                "pandas"
                            ]
                        }
                    }
                },
                "newline": {
                    "default": "\n",
                    "description": "One or more characters indicating a newline. Defaults to '\\n'.",
                    "type": "string",
                    "options": {
                        "dependencies": {
                            "filetype": [
                                "map",
                                "ply",
                                "netcdf",
                                "wofost",
                                "table",
                                "mat",
                                "ascii",
                                "pandas",
                                "obj",
                                "yaml",
                                "json",
                                "pickle"
                            ]
                        }
                    }
                },
                "read_attributes": {
                    "default": false,
                    "description": "If True, the attributes are read in as well as the variables. Defaults to False.",
                    "type": "boolean",
                    "options": {